doc_id,text_ocr
corpus-test-168,"FDA's Policy Interests FDA Protecting the public from harmful products Protecting the public from fraudulent products with unproven disease claims (which could result in patients foregoing proven treatments Incentivizing rigorous scientific research to support beneficial therapies (through requiring NDAs) Protecting human subjects involved in research (through requiring INDs) Protecting the integrity of the conventional food supply and dietary supplements Respecting the ""right to try"" unapproved drugs for seriously ill patients"
corpus-test-169,"FDA Support for Drug Development FDA (cont'd) Botanicals Team available to guide development of drugs from plants Can request Botanicals Team participation, to gain clarity on characterizing an investigational botanical drug to support proposed clinical study or NDA submission Controlled Substances Staff available to help with FDA- DEA interactions E.g., issues around abuse potential assessment requirements to support an NDA submission"
corpus-test-171,Other Applicable Regulatory FDA Requirements for Foods All foods are subject to a number of other regulatory requirements related to topics such as: — Safety of ingredients — Production controls - Labeling
corpus-test-173,"THC and CBD in Dietary FDA Supplements: 201(ff)(3)(B) It is unlawful to market CBD and THC products as, or in, dietary supplements, regardless of whether the substances are hemp- derived. CBD and THC products are excluded from the definition of dietary supplements under the FD&C Act Under sections 201(ff)(3)(B)(i) and (ii) of the FD&C Act, if a substance (such as THC or CBD) is an active ingredient in a drug product that has been approved under 21 U.S.C. § 355 (section 505 of the FD&C Act), or has been authorized for investigation as a new drug for which substantial clinical investigations have been instituted and for which the existence of such investigations has been made public, then products containing that substance are outside the definition of a dietary supplement. Exception: If the"
corpus-test-175,"Current FDA Warning Letters FDA Related to CBD Products FDA has issued numerous WLs from 2015 to present Unapproved new drugs [§§201(p), 301(d), and 505(a)] Misbranded drugs [§§301(a) and 502(f)(1)] Illegally marketed food [§301(II)] — Illegally marketed supplements [§201(ff)(3)(B)] FDA posted lab results for dozens of CBD products cited in the warning letters. — In many cases, the CBD content did not match the labeled claims and some products did not contain any CBD"
corpus-test-176,"FDA Challenges Challenges include: Rapidly-changing legal frameworks at the federal, state, and local level Continually evolving market with many types of products Need for more data (e.g., safety) Need to support rigorous scientific research into therapeutic uses of products from cannabis Impact of Farm Bill on CBD for research Resources"
corpus-test-179,"FDA and Cannabis FDA Regulatory roles under the Federal Food, Drug & Cosmetic Act (FDCA): Scientific and regulatory support for research on potential therapeutic uses of cannabis Regulation of products (e.g., foods, drugs, cosmetics) from cannabis Enforcement actions as necessary against products made from cannabis or containing compounds found in the cannabis plant, particularly those that present human health risks FDA roles under the Controlled Substances Act (CSA): Assisting the Drug Enforcement Administration (DEA) on protocol registration for Schedule I drug research (Under 21 CFR 1301.18 and 1301.32) •Conducts scientific and medical analysis ('8-factor analysis') to recommend appropriate controls under the CSA (working with NIDA) - At DEA request — Responding to citizen petitions - "
corpus-test-180,FDA Summary and Conclusions FDA has a well-defined role to play in the regulation and development of products containing cannabis and cannabis-derived compounds FDA continues to focus on supporting scientific and rigorous testing and approval of drugs derived from cannabis FDA will solicit input on how to make legal pathways for the lawful marketing of these products more efficient FDA will continue to protect and promote the public health with respect to these products 21
corpus-test-181,FDA U.S. FOOD & DRUG ADMINISTRATION
corpus-test-182,"FDA Regulatory Landscape Federal/state coordination is necessary: - States - DEA - FDA - USDA - OtherS: SAMHSA, NIDA, ONDCP"
corpus-test-183,"FDA Intra-Agency Team FDA has a cross-Agency team that works on cannabis issues: All product divisions represented as well as field inspectorate Policy Enforcement Outreach Interagency coordination - Federal, state, international"
corpus-test-185,FDA The Farm Bill - FDA FDA's authorities under the FD&C Act and section 351 of the PHS Act were specifically preserved by the Farm Bill. Cannabis and cannabis-derived products are subject to the same authorities and requirements as FDA-regulated products containing any other substance.
corpus-test-186,"FDA Overview of FDA Drug Authority Under the FD&C Act, any product, including a cannabis product (hemp or otherwise), that is marketed with a claim of therapeutic benefit, or with any other disease claim, is considered to be a drug. A new drug must be approved by the FDA for its intended use before it may be introduced into interstate commerce."
corpus-test-187,"Drug Development from Cannabis FDA Development of drugs has focused on using compounds in cannabis: CBD, THC Sativex Four products approved: — Marinol (dronabinol) (1985): nausea from GW CAlniral chemotherapy. Schedule III - Cesamet (nabilone) (1985 (2006)): nausea & neuropathic pain. Schedule II — Syndros (dronabinol) (2016): nausea from cancer chemotherapy. Schedule II - Epidiolex (CBD) (2018): for childhood seizures. EPIDIOLEX Schedule V"
corpus-test-189,"Federal Efforts to Prevent Drug Shortages An FDA Perspective Douglas C. Throckmorton, MD Deputy Director for Regulatory Programs Center for Drug Evaluation and Research FDA Duke Margolis Center for Health Policy November 27, 2018"
corpus-test-190,"Definitions of Medical Product Shortage Drug Shortage (FDA): A drug shortage means a period when the demand or projected demand for the drug within the United States exceeds the supply of the drug. Drug Shortage (ASHP*): A drug product is in shortage: - once the shortage is verified with manufacturers - when supply issues affect how a pharmacy prepares or dispenses a drug product, or influence patient care requiring prescribers to use an alternative therapy *ASHP: American Society of Health-System Pharmacists"
corpus-test-191,FDA Thank You
corpus-test-192,"rends In New Drug Shortages 201o-2017 300 250 Number of New Shortages 200 150 100 50 0 2010 2011 2012 2013 2014 2015 2016 2017 Calendar Year CDER CBER From FDA Drug Shortage Report to Congress, 2017 https://www.fda.gov/downloads/Drugs/DrugSafety/DrugShortages/U CM610662.pdf"
corpus-test-193,"Sources of Shortages: Manufacturing Challenges Consolidation in manufacturing of sterile injectables In Fall of 2017, interruption of manufacturing by a single firm led to shortages of multiple critical drugs including injectable narcotics, ""caines"" and others drugs Shortages of critical sterile injectable drugs from increased demand or manufacturing problems IV electrolyte salts, Magnesium Sulfate, Calcium Gluconate and Potassium Chloride"
corpus-test-194,Sources of Shortages: Natural Disasters Hurricane Maria affected multiple manufacturers in Puerto Rico IV fluid shortages which began in 2014 were worsened due to Baxter facility impact in PR
corpus-test-195,"What FDA Does to Address s Drug Shortages Drug Shortage Staff focused on addressing drug shortages Facilitate temporary and long-term strategies to address shortages •Coordinate timely and comprehensive risk/benefit decisions within FDA •Personnel across multiple FDA Offices involved in shortage response Distribute information (web posting, professional organizations): https://www.fda.gov/Drugs/DrugSafety/DrugShortages/default.htm Goal: Maintain availability while minimizing risk to patients"
corpus-test-197,Lessons Learned Availability of drugs for patients is critical for healthcare - Interruptions of drug manufacturing due to any reason can lead to drug shortages with devastating impact on public health Sources of drug shortages include manufacturing challenges and natural disasters - FDA response tailored to address underlying cause(s) - Communications and information sharing are critical both to preventing and to mitigating shortages Recovery from shortages takes time. Prevention is critical to reducing the numbers of drug shortages
corpus-test-198,"Communication is Critical Requirements to Industry For Early Notification Manufacturers are required to notify the FDA of a permanent discontinuance or interruption in manufacturing that is likely to One Wundred Twelfth Congress lead to a meaningful disruption in the supply of the Anited States of America of a covered drug in the United States AT THE SECOND SESSION Begnn and keld ant the City of Wankington on Taeadey. •At least 6 months in advance of but in no the third dey of Jaanry, tar thennd and nacele case later than 5 business days after the an act the Federal Facd, Dernag. aud Con interruption in manufacturing occurs the Cnited States of Amerien in Congress coserebled. Lo if emapcted be the Senate and Moase of Renresentatires af SECTION 1. SHBORT TITLE This Act may be cited as the """
corpus-test-199,"Today's Meeting Discussion goals: Root Causes of drug shortages Economics of drug shortages •Measurement of shortages and their public health impact Economic drivers underlying drug shortages Manufacturing and Distribution Anticipating vulnerabilities, eliminating barriers to adequate drug supply Potential tools to address drug shortages • Market-driven actions • Governmental actions • Incentives to encourage adequate drug supply and manufacturing redundancy and resiliency"
corpus-test-200,"FDA U.S. FOOD & DRUG ADMINISTRATION CDER Office of Surveillance and Epidemiology: 2018 Update Gerald J. Dal Pan, MD, MHS Director Office of Surveillance and Epidemiology Center for Drug Evaluation and Research FDA/CMS Summit December 11, 2018"
corpus-test-201,"Label Changes Study FDA HIGHLIGHTS OF PRESCRIBING INFORMIATION CONTRAINDICATIONS These highlights do not include all the information needed to use [DRUG NAME] safely and effectively. See full prescribing information for [text] [DRUG NAME]. [text] [DRUG NAME (nonproprietary name) dosage form, route of -WARNINGS AND PRECAUTIONS administration, controlled substance symbol] [text] Initial U.S. Approval: [year] - [text] -ADVERSE REACTIONS WARNING: [SUBJECT OF WARNING] Most common adverse reactions (incidence > x%) are [text] See full prescribing information for complete boxed warning. [text] To report SUSPECTED ADVERSE REACTIONS, contact [name of [text] manufacturer] at [phone #] or FDA at 1-S00-FDA-10SS or www.fda.gow/medwatch. RECENT MAJOR CHANGES [section (XX)] [m/year] [text] ...-DRUGINTERA"
corpus-test-202,FDA U.S. FOOD & DRUG ADMINISTRATION Sentinel
corpus-test-203,"FD FDA Sentinel System National medical product monitoring system 17 data partners with 178 million members with pharmacy and medical coverage Distributed system where data partners retain physical control of data to protect privacy and security Sentinel Sentinel Drugs Vaccines, Blood & Biologics Communications FDA-Catalyst Sentinel is www.sentinelinitiative.org/ Product Monitoring System LEARN MORE"
corpus-test-204,Analysis in Sentinel's Distributed Data Network Mini-Sentinel Operations Center 1- User creates and 6 submits query Mini-Sentinel Secure Network Portal (a a computer program) 2- Data partners Data Partner 1 retrieve query Review & Run Review & Query Return Results 3- Data partners review Enroll and run query against Demographics Utilization their local data Pharmacy Etc 4- Data partners review results Data Partner N Review & 5- Data partners return Review & Run Query Return Results results via secure Enroll network Demographics Utilization Pharmacy 6- Results are Etc aggregated
corpus-test-205,"ARIA is Comprised of Modular Programs Level 3 Level 2 Sequential Adjusted Analyses with Level 1 Adjusted Analyses with Sophisticated Descriptive Sophisticated Confounding Control Analyses, Confounding Control Unadjusted Rates"
corpus-test-206,"FDA The NEW ENGLAND Perspective JOURNAL of MEDICINE The FDA Sentinel Initiative — An Evolving National Resource Richard Platt, M.D., Jeffrey S. Brown, Ph.D., Melissa Robb, M.S., Mark McClellan, M.D., Ph.D. Robert Ball, M.D., M.P.H., Michael D. Nguyen, M.D., and Rachel E. Sherman, M.D., M.P.H. L he Food and Drug Adminis- secure querying system, created a viding guidance on the best use tration (FDA) Sentinel Initia- very large rigorously curated and of their data. Although data part- tive,1 which was launched in 2008, updated distributed health infor- ners have chosen to respond to has matured from a pilot program mation data set, and developed nearly all questions sent to them, designed to assess potential drug- tools permitting rapid, customized their ability to opt out of specific safety"
corpus-test-207,"The NEW ENGLAND Perspective JOURNAL of MEDICINE Just as the Sentinel Initiative looks The Sentinel Initiative can become a very different today than it looked 5 critical component of the FDA's years ago, in 5 to 10 years the system implementation of its mandates will have improved capabilities and under the 21st Century Cures Act by will use new data sources and providing data and expertise to methods. support the incorporation of real- salety signais in mnsurance ciaims analysis. world data into regulat ntory decision into a core component of the Distributed agency's evolving safety surveil- which data making in other areas in addition to lance system. Sentinel is a flexi- physical and safety ble and robust program that pro- over their da assessments. vides evidence on the effects of leve"
corpus-test-208,"Sentinel Strategic Plan VISION sustainable national resource to monitor the safety of marketed medical World Data sources used to products, and expand Real- capture medical product performance STRATEGIC OBJECTIVES Accelerate utility of Real- Increase the Meet legislative Facilitate use use of the World Data to regarding medical mandates by other Sentinel System within FDA and accelerate drug stakeholders development product safety and foster scale capabilities to meet needs and assess and effectiveness innovation & medical development product performance STRATEGIC AIMS Enhance the foundation Further enhance safety capabilities to and broader use Accelerate access of the Sentinel System Create a national knowledge and Disseminate (data, intrastructure, by leveraging of Real-World Data resou"
corpus-test-209,FDA Sentinel ARIA Analyses (N=256) 70 60 50 40 30 3 2 56 15 15 3 12 20 10 3 12 4 10 16 16 19 16 15 16 10 0 0 Q1 Q2 Q3 Q4 Q1 Q2 Q3 Q4 2016 2016 2016 2016 2017 2017 2017 2017 Summary Table Level 1 Level 2 Level 3
corpus-test-210,"FDA Drug Safety in Pregnancy in a Large, Multisite Database: Advances in Analytic Methods, Querying Tools, and Supplemental Data Collection from Patients Danijela Stojanovic, Liz Suarez, Susan Andrade, David Martin Friday, November 30, 10-11am EDT MACOEPIOEE 1 2 3 4 Danijela Stojanovic Liz Suarez Susan Andrade David Martin New Mother- New ICD-10 Validation of Open Source Infant Linkage Gestational Age ICD-10 Stillbirth Mobile App for Algorithm Algorithm Data Collection https://www.sentinelinitiative.org/communications/sentinel-initiative-events/drug-safety-pregnancy-large-multisite-database-advances"
corpus-test-211,"FDA U.S. Department of Health and Human Services U.S. FOOD & DRUG A to Z index | Folow FOA | ExEspaial ADMINISTRATION Search FDA α Home Food Drues Medical Devices Radation-Emiting Products Vaccines, Blood & BiologicsArimal & Veterinary Cosmefics Tabacco Products Drugs Home > Drugs > Science & Research (Dnugs) Science & Research (Drugs) FDA's MyStudies Application (App) Regulatory Science at CDER f OHRE TWEET in LUINKEDI PN IT ENAL PRINT Resrarch Tiols and Resources researchers and developers to customize and use the FDA's newly created MyStudles app. The FDA MyStudies The U.S. Food and Drug Administration (FDA) is posting computer code and a technical roadmap thalt will allow Partnerships and Consortia Scientific Public Private App is designed to faciitate the input of real worid data dire"
corpus-test-212,Data Source - Issues FDA Issue were identified by reviewing label and approval letter Issues were recorded as stated in the label text A second reviewer independently reviewed the abstracted individual safety issues Enumerated the number of issues incorporated into: - Each relevant section of the label - Issues per labeling update Source: Pinnow et al. Clin Pharmacol Ther 2017 Dec 20 doi: 10.1002/cpt.994 [Epub ahead of print]
corpus-test-213,"FDA FDA My Studies Mobile App FDA Standard frameworks - ResearchKit STUDIES (iOS), ResearchStack (Android) Gateway capability Welcome! Web-based configuration portal Secure Storage Environment - FISMA complaint Partitioned for distributed research Responses can be downloaded in broadly compatible formats (e.g., Get Started for use in SAS, Excel, etc.) New User? Sign in"
corpus-test-214,"FDA Signal Detection Approaches Available in Sentinel Pre-Specified Panel of Select Outcomes Prospective sequential surveillance tool (Level 3) One Product, All Outcomes TreeScan One Outcome, All Products DrugScan All Products, All Outcomes No existing tool in Sentinel"
corpus-test-215,FD Proposed Sentinel Signal Identification Process Integrated Safety Summary Clinical Trial Data Prescribing Information Signal identification led by Select 1 product Divisions of Pharmacovigilance Choose study design(s) or tool and Sentinel Program Team Conduct analysis Review and classify statistical alerts Follow up investigations to be conducted by Divisions of Integrate results with other sources of Epidemiology information Identify Outcome for Further Evaluation (if any)
corpus-test-217,"F FDA's Sentinel Initiative - News and Events f SHARE TWEET in LINKEDIN PIN IT EMAL PRINT FDA is committed to an open public process that will enable information to be disseminated and stakeholder contributions to be gathered as it explores the scientific, technical, and policy issues that will affect the Sentinel System's development. Sign up for E-mail Updates Upcoming Events Eleventh Annual Sentinel Initiative Public Workshop The Sentinel Initiative was launched in response to the Food and Drug Administration Amendments Act of 2007 (FDAAA) and is comprised of several components including the Sentinel System@, the Active Risk Identification and Analysis, the Biologics Effectiveness and Safety System (BEST IDIQ #1, BEST IDIQ #2) and FDA Catalyst@. The Food and Drug Administration (FDA) is"
corpus-test-218,"FD Sentinel Annual Meeting | Day 1 DAY 1 | Sentinel Initiative Public Workshop, April 3, 2019 Registration: Open to everyone. Please register through this Duke Margolis link@. Location: Hyatt Regency Bethesda 1 Bethesda Metro Center Bethesda, MD 20814 Agenda and Details: Day 1 will be convened by the Robert J. Margolis, MD, Center for Health Policy at Duke University under a cooperative agreement with FDA. The workshop will feature updates on how the Sentinel Initiative is being used by FDA as a core safety surveillance program from leaders at FDA and from investigators within the Sentinel Initiative. Discussion will also highlight strategic initiatives and potential future directions for continued improvements to the distributed data infrastructure. There will be opportunities throughout "
corpus-test-219,"FDA Sentinel Annual Meeting | Day 2 DAY 2 | Sentinel System Analysis Tools Training: Hands-On Workshop, April 4, 2019 Registration: Open to everyone. Please register through this Day 2& link. Location: FDA White Oak Campus 10903 New Hampshire Avenue Building 31, Room 1503 A (the Great Room) Silver Spring, MD 20993 Agenda and Details: Day 2 will be the third public training sponsored by FDA and the Sentinel Operations Center targeting researchers who have prior experience executing epidemiologic analyses with claims data using SAS statistical packages and programming. Registrants are expected to have either attended the prior Sentinel Public Training Events held in July 2017 (Part 1)@ and February 2018 (Part 2) or viewed the recorded contents online prior to attending. This workshop will bu"
corpus-test-220,FDA U.S. FOOD & DRUG ADMINISTRATION Risk Evaluation and Mitigation Strategies
corpus-test-221,"FDA Development of a Shared System REMS This draft guidance is meant to enhance clarity and transparency of the development process Development of a for shared system REMS, specifically it: Shared System REMS - Provides recommendations for industry on the Guidance for Industry development of a shared system REMS for multiple prescription drug products, including DRAFT GUIDANCE biological products Provides information about the benefits of shared ot should be ual Fulars Lane. Rms. 2be1, Bodkysh 1610 system REMS doclkrt sanber luted in the notice of arall aputbledes is Dhe Falieral R For guestions segauding this diafh Servellance and Epidessology. at 301-796-516) or (CBER) Offce of Comemmicatien ontact (CDER, Labea Mienchast. Office of Describes situations in which a shared system is Outeach"
corpus-test-222,"Waivers of the Single, Shared System REMs FDA Requirement This guidance is meant to provide clarity to help alleviate the delays in ANDA approvals Waivers of the Single, that can be caused by prolonged negotiations Shared System REMS over the development of a single, shared Requirement system REMS, specifically it: Guidance for Industry — describes the factors FDA will consider in evaluating a request for a waiver of the single, shared system requirement DRAFT GUIDANCE This gaidance documrnt is being dintrtbuted for commrnt purposes oaly provides recommendations to ANDA applicants 5630 regarding the submission and content of waiver requests For questions regarding ths dadt docunrnst, coetact the Cester for Deag Exslsation and (CBER, 800-835-4709 or 240-402-4000 Reseaech (CDEX) at 36s-796-2"
corpus-test-223,"Results FDA 278 NMEs approved between October 1, 2002 and December 31, 2014. 1 safety withdrawal 195 (70.1%) with ≥ 1 safety outcome 83 (29.9%) no safety related label change or withdrawal RESULTS"
corpus-test-224,FDA issued its report on the use of accredited CE as a PD method to implement HCP education under a REMS Part of the REMS Integration Initiative FDA looked at the feasibility of using Continuing Education for REMS and Continuing individual REMS Education for Report concluded that CE can be Health Care Providers a useful too to implement HCP education: — Will likely require FDA to provide a FDA Feasibility Report blueprint which serves as the basis for the content of the education - More practically implemented in the postapproval setting
corpus-test-225,"FDA REMS Resources Portal FDA Launched in 2018 in response to stakeholder requests for easier access and to improve their understanding of REMS U.S. FOOD & DRUG ADMINISTRATION New REMS Webpages Launched Today the U.S. Food and Drug Administration (FDA) is launching a new sct of web pages that aims to provide a one-stop source for general information about Risk Evaluation and Mitigation Strategy (REMS) programs. These webpages organize general REMS information according to audience (i.e., patients, heaith care professionals and industry) and most pages are presented in a short question and answer format. In 2007, the Food, Drug Administration Amendments Act gave FDA the authority to require a REMS when FDA determines i is necessary to ensure the benefits of the drug outweigh the risks. Over"
corpus-test-226,"Navigating Within the Portal F ""Landing page"" ""Navigation Ba Risk Evaluation and Mitigation Drugs Strategies (REMS) Risk Evaluation and Mitigation Strategies (REMS) What's in a REMS? Frequently Asked Questions (FAQs) about REMS infuruung andior supparting the axacution of the safle uise corditions describad in the madir atior's RigMs are desiqred to help reduce the occumence andior severity of certiain serious risks, by FOul-approvied presicriding information. Roles of Different Participants in oEsuts ane nat designed to mntgate at the adverse evenits of a medication, these ane communic aled to heath (ane REMS anaging a specifc serious nsx by inforning. educating andior resforcing actons to reduce the tequency andior nion, Rathver sirsuts facus on previeting, momloring andioe severify of t"
corpus-test-227,FDA U.S. FOOD & DRUG ADMINISTRATION Medication Error Prevention Program
corpus-test-228,"Contents of a Complete Submission for Threshold Analyses FD and Human Factors Submissions Draft issued in September Contents of a Complete 2018 Submission for Threshold Describes to industry and Analyses and Human Factors Submissions to Drug FDA staff the contents of and Biologic Applications and submission procedures Guidance for Industry and FDA Staff for threshold analyses and DRAFT GUIDANCE human factors submissions that will support efficient an m 10 Rodyie, MD For questions regarding ths dat docammst, contact Qendh Nhe Niparyemn, 368-796- 6273, or Agency review, and (CBER) Ctice of Commmanication, Outeach and Develapmmt, 806-435-4709 or 240-400-8010 U. Departanent of Hieadth and Haauan Services presents timelines for FDA's Center for Drug Evalnation and Rarsearch (CIEX) Food and Drng"
corpus-test-230,FDA U.S. FOOD & DRUG ADMINISTRATION Prescription Opioid Abuse
