doc_id,text_ocr
corpus-test-82,"FDA The Global Drug Manufacturing Supply Chain Imported Finished Drug Ingredients Ingredients Manufacture of Ingredients Finished Drug Active (API) ingredient (APl) made in China and ingredients made in Europe, Japan, or the U.S. These components may shipped to India where the finished drug is manufactured and then imported into the U.S. for distribution."
corpus-test-85,"FDA Imports Continue to Increase Food Approximately 49% of fresh fruits and 25% of vegetables are imported 89% of seafood eaten domestically comes from outside the United States Devices Based on dollar values, at least 35% of all medical devices used in the United States are imported Drugs/Biologics 80% of Active Pharmaceutical Ingredient manufacturers are located outside the United States - Based on dollar values, more than 40% of biologics are imported 40% of finished drugs come from overseas 29"
corpus-test-86,"The Impact of Globalization FDA on FDA's Mission Foreign production of FDA-regulated goods and materials has exploded over the last decade FDA-regulated products originate from more than: 150 countries 130,000 importers 300,000 foreign facilities Number of FDA-regulated shipments at 300 U.S. ports has more than doubled during the last ten years. From 2006, shipments of imported food and medical products crossing our borders went from approximately 15 million to 34 million"
corpus-test-87,"FDA FDA Mission FDA is responsible for protecting the public health by assuring the safety, efficacy, and security of human and veterinary drugs, biological products, medical devices, our nation's food supply, cosmetics, and products that emit radiation."
corpus-test-88,"Critical Part of FDA Work: FDA Responding to New Challenges Public health challenges need to be addressed promptly and fully as they arise Part of FDA mission -- 'Protect and Promote' Contaminated compounded steroids and heparin Prescription opioid abuse Complex medical, social, scientific issue Over 15,000 overdose deaths in US last year associated with opioid use"
corpus-test-89,"Overdose Death Rates 1999 2014 Year 2014 Estimated Age-adjusted Death Rate per 100,000: 0-2 2.1-4 4.1-6 6.1-8 8.1-10 |10.1-12 12.1-14 14.1-16 16.1-18 18.1-20 >20 >20 igned by L. Rossen, B. Bastian & Y. Chong. SOURCE: CDC/NCHS, National Vital Statistics System Science = Solutions"
corpus-test-90,Important: FDA One of Many Stakeholders FDA evaluates benefits/risks for the population Benefits Risks Provider evaluates FRR benefits/risks BBBB for a patient BBBB Risks Benefits Patient Benefits Risks evaluates benefits/risks in terms of personal values
corpus-test-91,FDA Organization FDA Office of the Commissioner Office of Regulatory Affairs Center for Center for National Center for Center for Center for Veterinary Food Center for Center for Drug Biologics Devices & Medicine Safety & Toxicological Tobacco Evaluation Applied Evaluation & Radiological Research & Research Nutrition Research Health
corpus-test-92,"FDA FDA's Current Resources Total annual budget $4.39 billion for FY 2014 User Fees - $1.83 billion, approximately 42% of total Appropriated Funds - $2.56 billion, about $8 per citizen 15,705 FTEs, 77% with college degrees, 21% with doctorates 223 U.S. offices and 13 laboratories 11 international offices and posts in 8 countries 35"
corpus-test-93,"Who Works at FDA? FDA Chemists - review the drug substance, product, and manufacturing process Biologists - review biological products Toxicologists - review the non-clinical studies Pharmacologists - review drug pharmacokinetics, exposure-response, drug-drug interactions Statisticians - review all types of studies; design and analysis Physicians & Pharmacists - review clinical protocols, safety and efficacy data Manufacturing science specialists Engineers Project managers - the glue that holds us all together 36"
corpus-test-95,FDA What is the Role of the Regulator in Responding to Public Health Challenges and Supporting Innovation?
corpus-test-96,"FDA: First Focused on Core Business Functions Pre-Market Review Product Safety & Compliance Assessment of safety Inspection of and effectiveness of manufacturing facilities new medical and products to assure technology & safety, quality & safety of new food compliance with FDA ingredients regulations Consumer & Patient Safety Post-marketing surveillance to ensure the safety of consumers & patients who use FDA- regulated products 39"
corpus-test-97,"FDA 5 ""Moral Imperatives"" of Government Regulation GOVT. REGULATIONS Protect the Public from Harm Preserve Maximum Individual Freedom of Choice Guarantee Meaningful Public Participation in the Decision-Making Process Promote Consistent and Dependable Rules that are Equally Applicable to Everyone Provide Prompt Decisions on All the Issues that Arise in a Regulatory Context ---Peter Barton Hutt: Five Moral Imperatives of Government Regulation, in The Hastings Center report, February 1980 40"
corpus-test-98,"FDA FDA Mission FDA is also responsible for advancing the public health by helping to speed innovations that make medicines more effective, safer, and more affordable and by helping the public get the accurate, science- based information they need to use medicines and foods to maintain and improve their health. FDA also has responsibility for regulating the manufacturing, marketing and distribution of tobacco products to protect the public health and to reduce tobacco use by minors. 5"
corpus-test-99,"FDA Role for the FDA Beyond These Core Functions to Aid Innovation We are uniquely situated to contribute to innovation: - Legal role in application of regulations — Focus on public health mission — Regulators in unique position to see needs across disease areas — Regulators in unique position to respond to needs — Regulators have identified obligation to support improved regulation, aided by harmonization/convergence"
corpus-test-100,"Role for the FDA Beyond FDA These Core Functions to Aid Innovation Expanded FDA role — c/w mission: ..'promote' the availability of novel medical therapies for the US population Provide clear roadmap to speed development — Guidances on innovative approaches: Adaptive Trial Designs, Use of Meta-Analysis Tools - Drug Development Tools: Patient-Reported Outcomes, Biomarkers, Animal Models — Meetings targeted at supporting innovation"
corpus-test-101,"Role of the Regulator: FDA Supporting Continued Progress Invest in appropriate collaborative partnerships: interdependence is the reality - Broaden the conversations beyond usual partners and topics for models and expertise Acknowledge differences exist (e.g., between regulators, regulations, needs, values) Build opportunities to harmonize existing knowledge, databases and standards Be prepared to question assumptions"
corpus-test-102,WARNING S CHALLENGES AHEAD
corpus-test-103,"FDA Summary/Conclusions This is a transformational time in healthcare. Expectations, resources, and challenges all changing FDA has a clear and understood role to support our public health mission, including the need to support change and innovation, while remaining true to our historic mission - Transparency, focus, collaboration, and flexibility are essential for success"
corpus-test-105,FDA U.S. FOOD & DRUG ADMINISTRATION
corpus-test-106,"FDA FDA Mission Finally, FDA plays a significant role in the Nation's counterterrorism capability. FDA fulfills this responsibility by ensuring the security of the food supply and by fostering development of medical products to respond to deliberate and naturally emerging public health threats."
corpus-test-107,"FDA A Brief History of FDA Regulation and Its Impact on Good Science 1890s - Discovery of diptheria antitoxin gave rise to increased production 1901 -- Problems from both public and commercial labs, especially tetanus deaths from contaminated diphtheria antitoxin and smallpox vaccine 1902 - Passage of Biologics Control Act"
corpus-test-109,FDA 1902 Biologics Control Act Scientifically trained staff must supervise production of these medicines Licensing of facilities by PHS Inspections of establishments and testing of biologics for purity and potency Standards issued for products Enhanced scientific legitimacy on firms and their products Scientific infrastructure mandated under the law helped promote new product development.
corpus-test-111,"FDA U.S. FOOD & DRUG ADMINISTRATION STATE OF OGD: Pivoting to GDUFA II Kathleen Uhl, MD Director, Office of Generic Drug CDER/FDA AAM Fall Technical Conference November 6, 2017"
corpus-test-112,"FDA Disclaimer This presentation reflects the views of the speaker and do not reflect official FDA, HHS, or other government opinion or policy. I have nothing to disclose. FY2017 data represent preliminary data that are being further reviewed and validated for official reporting purposes. October 1, 2017 used as cut-off."
corpus-test-113,"FDA To date, FDA has met or exceeded EVERY formal negotiated GDUFA goal"
corpus-test-114,"FDA Original ANDAs GDUFA goal: incremental increasing % meeting shorter review goals over Years 3, 4, and 5* FDA acted on: - Cohort Year 3 - 97% GOAL - 60% within 15 months of submission - Cohort Year 4 - 100% GOAL - 75% within 15 months of submission** - Cohort Year 5 - 99% GOAL - 90% within 10 months of submission** *Updated 10/1/2017. Numbers are based on preliminary data that will be reviewed and validated for official reporting purposes. Cohort Year 4 (FY2016) — Some are still under review and within goal; all mature by December 31, 2017. Cohort Year 5 (FY2017) — Many are still under review and within goal; all mature by July 31, 2018."
corpus-test-115,FDA Total ANDA Regulatory Actions per Month (AP+TA+CR+RTR) 300 290 269 78 250 266 245 249 249 241 239 243 243 223 225 230 229 225 227 200 206 189 192 193 186 178 173 50 00 50 0 Oct-15 Nov-15 Dec-15 Jan-16 Feb-16 Mar-16 Apr-16 May-16 Jun-16 Jul-16 Aug-16 Sep-16 Oct-16 Nov-16 Dec-16 Jan-17 Feb-17 Mar-17 Apr-17 May-17 Jun-17 Jul-17 Aug-17 Sep-17
corpus-test-116,"FDA First Regulatory Action - Rates Rate for all original ANDAs submitted for the respective month of submission 90% 80% 70% 60% 50% AP+1 40% CR RTR 30% 20% 10% 0% Oct-14 Nov-14 Dec-14 Jan-15 Feb-15 Mar-15 Apr-15 May-15 Jun-15 Jul-15 Aug-15 Sep-15 Oct-15 Nov-15 Dec-15 Jan-16 Feb-16 Mar-16 Apr-16 May-16 Jun-16 *Updated 10/1/2017. Numbers are based on preliminary data that willbe reviewed and validated for official reporting purposes. Cohort Year 4 (FY2016) — Some are still under review and within goal; all mature by December 31, 2017"
corpus-test-117,FDA ANDA Complete Response Letters (CRLs) 200 180 190 193 190 160 166 169 167 151 155 155 140 147 151 150 144 143 136 120 129 100 113 112 105 103 98 80 92 87 82 60 40 20 0 Oct-15 Dec-15 Jan-16 Feb-16 Mar-16 Apr-16 Jun-16 Jul-16 Aug-16 Sep-16 Oct-16 Nov-16 Dec-16 Jan-17 Feb-17 Mar-17 Apr-17 May-17 Jun-17 Jul-17 Nov-15 May-16 Aug-17 Sep-17
corpus-test-118,Overall Regulatory Actions... FDA Another Record Year Pre-GDUFA GDUFAI FY2012 FY2013 FY2014 FY2015 FY2016 FY2017 ANDA approvals 517 440 409 492 651 763 PAS approvals 275 535 659 624 481 431 Tentative Approval 102 95 91 120 184 174 (TA) Complete Response 84 1251 1254 1180 1725 1603 (CR) TOTAL ** 978 2321 2413 2416 3056 2971 DMF Completeness 0 1699 1706 901 886 820* Assessment (CA) * Updated 10/1/2017. Numbers are based on preliminary data that wil be reviewed and validated for official reporting purposes. 16
corpus-test-119,"FDA Annual Approvals & Tentative Approvals Approval Tentative Approval 1000 GDUFA starts, 10/1/12 900 174 800 184 700 600 102 120 500 139 139 95 91 400 763 300 517 492 200 426 458 440 409 100 0 FY 10 FY 11 FY 12 FY 13 FY 14 FY 15 FY 16 FY 17"
corpus-test-120,Monthly Approvals & FDA Tentative Approvals* Full Approvals Tentative Approvals 120 100 12 19 80 14 12 19 11 17 12 19 60 16 14 88 40 77 68 70 59 61 62 57 60 54 56 51 20 0 Oct-16 Nov-16 Dec-16 Jan-17 Feb-17 Mar-17 Apr-17 May-17 Jun-17 Jul-17 Aug-17 Sep-17
corpus-test-121,"FDA FY2017 - Notable ANDA Approvals Generic Name Reference Listed Drug Olmesartan Medoxomil Tablets, 5 mg, 20mg, and 40 mg Benicar Tablets Quetiapine Fumarate Extended-release Tablets, 50 mg, 150 mg, 200 mg, 300 mg, Seroquel XR Tablets 400 mg Dexlansoprazole Delayed-release Capsules, 60 mg Dexilant Capsules Atomexetine Capsules, 10 mg, 18 mg, 25 mg, 40 mg, 60 mg, 80 mg, and 100 mg Strattera Capsules Mesalamine Delayed-release Tablets USP, 1.2 g, and 800 mg Lialda and Asacol HD Delayed- release Tablets Emtricitabine and Tenofovir Disoproxil Fumarate Tablets, 200 mg/300 mg Truvada Tablets Sevelamer Carbonate Tablets, 800 mg; Powder for Oral Suspension, 0.8 g and 2.4 g Renvela Tablets and Powder for Pouches Oral Suspension Prasugrel Tablets, 5 mg, 10 mg Effient Tablets Isoproterenol Hydrochlo"
corpus-test-122,FD Prior Approval Supplements (PASs)
corpus-test-123,FDA Overview . Update on GDUFA I Receipts Actions towards Goals Other accomplishments 2. Brief comments on GDUFA ll 3. Closing Comments
corpus-test-124,"FDA GDUFA Goal: PAS 100% 100% 100% 100% 100% 100% 100% 100% l 97% 94% 98% 100% 97% 80% 60% 40% 20% 0% Jan-2016. Feb-2016 Mar-2016 Apr-2016 May-2016 Jun-2016 Jul-2016 S Aug-2016 Sep-2016 Oct-2016 Nov-2016 Dec-2016 Month-Year GDUFA PAS Goal * Goal dates provided on submissions received through December 2016, as those are the goal dates that have actually accrued. The cohort data is not mature enough to report on whole fiscal year data reliminary data that will be reviewed and validated for official reporting purposes."
corpus-test-125,FDA PAS Actions FY2013 FY2014 FY2015 FY2016 FY2017 Received 482 436 480 478 415 Approved 535 659 624 481 431 CR Letter 8 18 185 228 223 22
corpus-test-127,FDA GDUFA Goal: Controlled Correspondence Controlled Correspondence GDUFA Performance by FDA Receipt Date - All Disciplines 100% 99% 96% 98% 97% 95% 99% 100% 98% 98% 97% 99% 99% 80% 60% 40% 20% 0% Jul-2016 Aug-2016 Sep-2016 Oct-2016 Nov-2016 Dec-2016 Jan-2017 Feb-2017 Mar-2017 Apr-2017 May-2017 Jun-2017 Month-Year GDUFA Controlled Correspondence Goal * Goal dates provided on submissions received in FY 2016 and 2017. *Updated 10/1/2017. Numbers are based on preliminary data that will be reviewed and validated for official reporting purposes.
corpus-test-128,"FDA CONTROLS Increasing number of ""control"" submissions — >8,000 controls submitted in GDUFA I Increasing complexity Approximately 20% controls do not follow FDA guidance PLEASE READ and FOLLOW GUIDANCE - https://www.fda.gov/downloads/Drugs/GuidanceComplianceRegulatoryInformation/Guidances/UCM411478.pdf 25"
corpus-test-129,"FDA OGD FILING REVIEW > 1,100 original ANDAs, resubmissions, and PASs underwent filing review in FY2017"
corpus-test-130,"FD REFUSE TO RECEIVE (RTR) ~10-30% of ANDAs submitted get RTR ~1% fees not paid % ANDAs RTR-ed* FY2015 (cohort Year 3) 34.3 FY2016 (cohort Year 4) 28.3 FY2017 (cohort Year 5**) 10.5 Overall RTR % FY15-17 20.9 Updated 10/1/2017. Numbers are based on preliminary data that will be reviewed and validated for official reporting purposes. Y2017) - Given the large number of ANDAs submitted in the end of FY2017, many ANDAs undergoing Filing Review."
corpus-test-131,"FDA REASONS FOR REFUSE TO RECEIVE (RTR) DEFICIENCY % Inadequate Stability 31.1% Inadequate Dissolution 17.8% Incomplete English translation 17.4% No response with 7 calendar days 6.4% Incomplete Response 5.5% Not Q/Q Same 4.6% Incomplete DMF 4.1% Inadequate EA or Categorical Exclusion 3.2% Incomplete/Failed BE studies 2.7% Inadequate justification of excipients 2.7% Analysis of FY2016 Year 4 cohort, 218 RTRs on 855 ANDAs"
corpus-test-132,"FDA RTR is a CRITICAL ""Vital Sign"" If ANDA received RTR.... — Less 1st cycle AP or TA — More deficiencies in CRL — Worse (""major"") deficiencies — If RTR resubmitted quickly to FDA, even lower likelihood for AP or TA"
corpus-test-133,"FDA RTR is a CRITICAL ANDA ""Vital Sign"" WITH WITHOUT Regulatory Action prior RTR prior RTR* Approved or Tentative Approval 3.8% 11.5% Complete Response Letter (CRL) 96.2% 86.9% Analysis of FY2015 Year 3 cohort, conducted 8/9/2017; n=400 ANDAs, all underwent extensive review. Results of First Regulatory Action following first cycle review."
corpus-test-135,FDA GDUFA I Regulatory Science Accomplishments* Issued 108 external research grants and contracts — Prepared OGD for industry interaction on complex drug products Published 788 Product Specific Guidances (PSGs) — 495 new PSGs and 293 revised PSGs — Increased number for complex drug products each year Reviewed 127 pre-ANDA meeting packages — Almost all for complex drug products -
corpus-test-136,FDA Product-Specific Guidances (PSGs) 250 New Guidance 223 Revised Guidance 194 200 150 134 154 135 108 Number 102 100 78 94 61 50 86 69 56 41 41 0 FY 13 FY 14 FY 15 FY 16 FY 17*
corpus-test-137,Product-Specific Guidances (PSGs) FDA Complex Drug Products 250 223 Complex? Yes 200 194 No 58 Number of Guidances 150 86 134 135 102 48 100 71 32 165 108 50 86 70 64 0 FY13 FY14 FY15 FY16 FY17 Numbers are based on preliminary data that will be reviewed and validated for official reporting purposes.
corpus-test-139,"FY2017 OGD Policy Accomplishments FDA * Co-led successful re-negotiation for GDUFA II October 2016 - Final Rule on ANDAs and 505(b)(2) Applications Developed policy and procedures to streamline the publication of Federal Register notices announcing the voluntary withdrawals of ANDAs under 21 CFR 314.150(c) Published 15 guidances - 7 - GDUFA II related Issued 7 MAPPs Orange Book Modifications ~ 5,600 NDAs and ANDAs to add RS and RLD designations and ~ 840 discontinued NDAs to provide RLD designations Supporting the Commissioner's Drug Competition Action Plan"
corpus-test-140,"FDA Commissioner FDA Scott Gottlieb, MD Huge interest and focus on Generic Drugs Numerous internal briefings provided regarding the generic drug program, GDUFA, Hatch-Waxman, and other activities Attendance at OGD All Hands Drug Competition Action Plan 2"
corpus-test-141,Communicating FDA's FDA Generic Drug Program REQUIRED: ENHANCED: GDUFA Performance Reports GDUFA Regulatory Science Annual GDUFA Financial Reports Report Activities Report of the Generic Drug Program Quarterly Meeting Minutes Between FDA and Industry QuarterlyGeneric Drug Review COMING SOON Dashboard GDUFA II Dashboards: ANDAFirst Generic Drug Approvals More metrics Office of Generic Drugs Annual Report Different reporting • Generic Drugs Updates and GDUFA Not OGD reports listserv Generic Drug Outreach Campaign 3
corpus-test-142,FDA Communicating FDA's Generic Drug Program GDUFA Outreach Videos Brief videos by FDA staff highlight new features in GDUFA II on FDA.gov. Topics include: GDUFA Overview Pre-ANDA Program for Complex Products Type Il Drug Master Files (DMF) Update Performance Goals Goals Integration Review Status Updates Post Complete Response Letter (CRL) Meeting Requests for Reconsideration Review Classification More to comeI
corpus-test-143,"FDA's Generic Review Pipeline By Submission Cohort as of September 30, 2017 First FDA review pending Under FDA Review (includes many re-submissions) PRE GDUFA SUBMISSIONS FY2013 FY2014 3. 4 ANDAs & Approvals & ANDA Re-submissions FY2015 Approvals FY2016 FY2017 Approximately 2,500 Total ANDAs To Industry From Industry Approx. 1,750 ANDAs w/ industry (1,400 pending response & 350 TÅs)"
corpus-test-144,"FDA Getting to ""Stable Footing"" ANDA Inventory 4,000 3,500 3,000 2,500 ANDAs 2,000 1,500 1,000 500 0 Jun-16 Aug-16 Oct-16 Dec-16 Feb-17 Apr-17 Jun-17 Aug-17 Oct, 2014 Dec, 2014 Feb, 2015 Apr, 2015 Jun, 2015 Aug, 2015 Oct, 2015 Dec, 2015 Feb, 2016 Apr, 2016 -With FDA -With Industry ae vfi"
corpus-test-146,"FDA ANDAs in CR status with industry FDA needs a better understanding of this — Predictors of when amendment will be submitted to FDA - Workload predictions and forecasting, capacity analytics, etc. FDA asked industry for data/analysis during QTR GDUFA II FDA-industry meeting"
corpus-test-147,"FDA Application ""approvability"" FDA will Approve or TA an ANDA WHEN it meets the Agency's standards for approval"
corpus-test-148,"FDA FIRST CYCLE APPROVALS* Low % FY2015 10.7% Lots of rework FY2016** 14.3% Inefficient use of resources Large number of ANDAs FY2017** 12.8% ""pending"" with industry, issued CR letters Critical to improve the ANDA Quality UP FRONT Updated 10/1/2017. Numbers are based on preliminary data that will be reviewed and validated for official reporting purposes. Cohort Year 3 (FY2016) — Some are still under review and within goal; all mature by December 31, 2017. Cohort Year 4 (FY2017) Many are still under review and within goal; all mature by July 31, 2018. pending submissions. DEFINITION: The percentage of AP and TA original and original-response to RTR ANDAs"
corpus-test-149,FDA Overview 1. Update on GDUFA I Receipts Actions towards Goals Other accomplishments 2. Brief comments on GDUFA Il 3. Closing Comments
corpus-test-150,"FDA GDUFA II - Numerous Review Program Enhancements •Mid-cycle & post CR t-cons, ability to dispute a variety of CDER actions More touch points with industry pre-, during, and post-submission — Pre-ANDA program for complex products Meetings, timeframes for Product-Specific Guidances, updates to Inactive Ingredients Database (IID) — ""PFC"" - Pre-submission Facility Correspondence Priority Submission with PFC - 8 month goal — All Pre-Year 3 ANDAs get a hard GDUFA II goal date vs. TADs - DMF enhancements - Accountability and reporting enhancements - Small business relief A"
corpus-test-151,"FDA GDUFA II ""Goals"" or ""Commitment"" letter: nttp:/ forindustry/userfees/genericdruguserfees/ucm525234.pdf PLEASE READ! KEEP CALM AND READ ON"
corpus-test-152,"FDA GDUFA II Pre-ANDA Program Session: — Tuesday November 7, 2017, 9:00am-10:00am"
corpus-test-154,FDA Lessons learned from PDUFA I-V & GDUFA I Critical/Pivotal role of RPM Complete Application is critical High quality NDA & ANDA applications result in: — Low Refuse To File (RTF)/Refuse to Receive (RTR) rates — First cycle approvals — Shorter time to approval
corpus-test-155,PDUFA Experience: Higher first cycle approval FDA rate achievable with high quality submissions CDER New Molecular Entity Approval Rates by PDUFA Cohort 100% 90% 80% % NMEs Receiving Approval 70% 60% 50% 40% 30% 20% 10% %0 6 12 18 24 30 36 42 48 54 Elapsed Time (months) •pre-PDUFA (1988-1992) PDUFA1 PDUFA1I PDUFAIII PDUFAIV •PDUFA V (receipts through 3/31/2015) * PDUFA V estimates based on 77 NMEs submitted in FY 2013 mid FY 2015 (it is too early to estimate performance for later submissions) Projection estimates account for actions to date and elapsed time to date for non-approvals Data as of 9/30/16
corpus-test-156,"FDA Projected vs Actual* ANDA Receipts 1600 FDA received an average of GDUFA implements, 10/1/12 1,000 ANDAs per year 1400 1473 under GDUFA I.. 1306 1200 Almost 7 years of projected ANDA 1103 receipts 1000 968 800 I 750 Projected ANDAs ATArA 852 per year 600 400 200 0 FY 12 FY 13 FY 14 FY 15 FY 16 FY 17"
corpus-test-158,"FDA CURRENT CHALLENGES High Rate of Refuse to Receive (RTR) - RTR'ed ANDAs: - Require more cycles to approval when finally received - Contain more/worse deficiencies than non-RTR'ed ANDAs Hidden facilities - Not identified on 356h form Risk getting a new/later GDUFA goal date when hidden facilities are found during review Limited awareness of benefits of Product-Specific Guidances Increasing workload: ANDAs, amendments, controls"
corpus-test-159,"ANDA ""Approvability"" FDA Build in Quality Up Front GDUFA I Cohort Year 5 timeline: IR #1 IR #2 Assessment Response Response Filing Review #1 and Received Received Wrap up Review Team Kick-Off Cumulative and Complete and and Final (OGD) Assignment Meeting IR #1 Reviewed Inspection Reviewed Review 6 O O O O O O 0 0 - 60d Within 70d 4mo Within 6.5mo - Within Within 90d Within 120d 6.5mo 7.0mo 8.5mo 9.0mo RIGHT Majority of deficiencies issued in CR letters: THE FIRST 1. Dissolution 2. Stability All are Quality-related (OPQ) 3. Excipients TIME"" 4. Facilities"
corpus-test-160,"FDA FDA is Successfully Delivering on GDUFA FDA continues to fulfill GDUFA commitments Continue to see increasing submissions, companies, workload, etc. Created a high functioning generic drug program Robust, modern, state of the art tools Sustainable and predictable Clear and consistent communication Fairness across applications and applicants"
corpus-test-162,FDA U.S. FOOD & DRUG ADMINISTRATION
corpus-test-163,"FDA ANDA Receipts (Originals + CR Responses/Amendments) 3,000 2,849 2,500 2,000 ANDA Receipts 1,848 1,500 1,547 1,000 500 0 FY 15 FY 16 FY 17 /2017. Numbers are based on preliminary data that will be reviewed and validated for official reporting purposes."
corpus-test-164,"FDA Monthly ANDA Receipts (New Originals) 250 225 235 200 202 197 175 180 150 125 114 100 108 75 78 81 75 73 73 69 66 67 50 61 56 58 60 59 57 58 42 35 40 25 0 Apr, 2016 May, 2016 Jun, 2016 Jul, 2016 Aug, 2016 Sep, 2016 Oct, 2016 Nov, 2016 Dec, 2016 Jan, 2017 Feb, 2017 Mar, 2017 Apr, 2017 May, 2017 Jun, 2017 Jul, 2017 Aug, 2017 Sep, 2017 Oct, 2015 Nov, 2015 Dec, 2015 Jan, 2016 Feb, 2016 Mar, 2016"
corpus-test-166,"FDA Average Monthly Controls Submitted 250 GDUFA implements, 10/1/12 222 200 150 157 127 100 101 91 79 50 0 FY 12 FY 13 FY 14 FY 15 FY 16 FY 17"
corpus-test-167,"FDA U.S. FOOD & DRUC ADMINISTRATION FDA Role in Regulation of Cannabis Products NIDA February 2019 Sharon Lindan Mayl, J.D. Senior Advisor for Policy Office of Foods and Veterinary Medicine Food and Drug Administration Douglas C. Throckmorton, M.D. Deputy Director for Regulatory Programs CDER, FDA"
